{
  "answers": [],
  "checkpoint_path": null,
  "created_at": "2026-07-20T20:25:48.866101Z",
  "creation_sequence": 3,
  "depends_on": [
    "J001"
  ],
  "id": "J003",
  "outcome": null,
  "parent_job_id": null,
  "pending_question": null,
  "priority": 60,
  "prompt_path": "jobs/J003/prompt.md",
  "recovery_policy": null,
  "related_reports": [],
  "report_path": "jobs/J003/report.md",
  "report_required": true,
  "revision": 2,
  "schema_version": 4,
  "session_ref": "ses_iteration1_impl_tde",
  "status": "running",
  "title": "Iteration 1 — Implementation: TDE Init + Disruption + Fallback + Accretion",
  "updated_at": "2026-07-21T18:16:54.779881Z",
  "waiting_on": []
}
