{
  "answers": [],
  "checkpoint_path": null,
  "created_at": "2026-07-20T20:25:48.866101Z",
  "creation_sequence": 5,
  "depends_on": [
    "J004"
  ],
  "id": "J005",
  "outcome": null,
  "parent_job_id": null,
  "pending_question": null,
  "priority": 40,
  "prompt_path": "jobs/J005/prompt.md",
  "recovery_policy": null,
  "related_reports": [],
  "report_path": "jobs/J005/report.md",
  "report_required": true,
  "revision": 2,
  "schema_version": 4,
  "session_ref": "ses_iteration1_architect_review",
  "status": "running",
  "title": "Iteration 1 — Architect: Cross-cutting Review and Iteration 2 Plan",
  "updated_at": "2026-07-22T22:48:50.235960Z",
  "waiting_on": []
}
