{
  "schema_version": 4,
  "id": "{{JOB_ID}}",
  "title": "{{JOB_TITLE}}",
  "status": "queued",
  "prompt_path": "jobs/{{JOB_ID}}/prompt.md",
  "session_ref": null,
  "priority": 0,
  "creation_sequence": 1,
  "depends_on": [],
  "parent_job_id": null,
  "waiting_on": [],
  "pending_question": null,
  "answers": [],
  "related_reports": [],
  "report_required": true,
  "report_path": "jobs/{{JOB_ID}}/report.md",
  "checkpoint_path": "jobs/{{JOB_ID}}/checkpoint.md",
  "outcome": null,
  "recovery_policy": null,
  "created_at": "{{CREATED_AT}}",
  "updated_at": "{{CREATED_AT}}",
  "revision": 1
}
