{
  "answers": [],
  "checkpoint_path": null,
  "created_at": "2026-07-20T20:25:48.866101Z",
  "creation_sequence": 2,
  "depends_on": [
    "J001"
  ],
  "id": "J002",
  "outcome": {
    "report_path": "jobs/J002/report.md",
    "status": "completed",
    "summary": "J002 iteration 1 — physics foundation, SPH solver, spatial hash, polytrope, unified gravity, conservation ledger, and all unit tests existed from prior interrupted worker. Verified all 49 tests pass. Need to record and commit."
  },
  "parent_job_id": null,
  "pending_question": null,
  "priority": 70,
  "prompt_path": "jobs/J002/prompt.md",
  "recovery_policy": null,
  "related_reports": [],
  "report_path": "jobs/J002/report.md",
  "report_required": true,
  "revision": 3,
  "schema_version": 4,
  "session_ref": "ses_iteration1_impl_foundation",
  "status": "completed",
  "title": "Iteration 1 â€” Implementation: Physics Foundation + SPH + Gravity",
  "updated_at": "2026-07-21T18:15:12.065760Z",
  "waiting_on": []
}
