{
  "answers": [],
  "checkpoint_path": null,
  "created_at": "2026-07-20T20:25:48.866101Z",
  "creation_sequence": 4,
  "depends_on": [
    "J001",
    "J002",
    "J003"
  ],
  "id": "J004",
  "outcome": null,
  "parent_job_id": null,
  "pending_question": null,
  "priority": 50,
  "prompt_path": "jobs/J004/prompt.md",
  "recovery_policy": null,
  "related_reports": [],
  "report_path": "jobs/J004/report.md",
  "report_required": true,
  "revision": 2,
  "schema_version": 4,
  "session_ref": "ses_iteration1_render_verify",
  "status": "running",
  "title": "Iteration 1 — Implementation: Rendering Contract + Verification + Performance",
  "updated_at": "2026-07-22T22:42:03.130800Z",
  "waiting_on": []
}
