{
  "answers": [],
  "checkpoint_path": null,
  "created_at": "2026-07-20T20:25:48.866101Z",
  "creation_sequence": 1,
  "depends_on": [],
  "id": "J001",
  "outcome": null,
  "parent_job_id": null,
  "pending_question": null,
  "priority": 80,
  "prompt_path": "jobs/J001/prompt.md",
  "recovery_policy": null,
  "related_reports": [],
  "report_path": "jobs/J001/report.md",
  "report_required": true,
  "revision": 2,
  "schema_version": 4,
  "session_ref": "ses_iteration1_proposal",
  "status": "running",
  "title": "Iteration 1 — Proposal: Review rebuild-tde-physics-core",
  "updated_at": "2026-07-20T20:26:12.682744Z",
  "waiting_on": []
}
